{"core_prompt_artifact_id":"sha256:ac40d1d3aa0493c371221c85afef5e0e627d20d61dad7310d8f3e3af6650072b","created_at":"2026-09-03T15:27:00Z","engine_repository_commit":"e27771bf4835c3f408552844523b5f3ac4a1f1b7","engine_source_hash":"sha256:6908882546e4cc26409a29d876948e3edd9d934814432d46b3a06e50313f8f14","executor":{"build_id":"generic-agent-files-v1","endpoint":"generic-agent-files","kind":"GENERIC_AGENT_FILES","max_attempts":1,"model":"host-code-agent","response_format":"RAW_JSON","timeout_ms":0},"extraction_build_hash":"sha256:91fd56e6638eeb620325d3ea24196460b099cf764fefbf75a8bafc0aa1b1f43a","extraction_build_id":"XBLD-555A5E21E238D5663122","extraction_profile_hash":"sha256:ce14bd20be0f8af35fb6031493288e7d58793c6ec738e466015c8f273d4c2471","payload_schema_artifact_id":"sha256:c3bfc04ed93d151d2c926cb6cb59ba4506507d77cd2f27c63df7426b67166bb6","profile_id":"xhnovel.secret-realm","profile_prompt_artifact_id":"sha256:f01faaa91c0541a1ed09de70cc647cfffb26397cae5fc4b9c2bfcaf73cd27a0e","profile_version":"1.0.0","schema_version":"extraction-build/v1","status":"UNQUALIFIED","unit_policy":{"id":"sliding-text/v1","overlap_chars":1800,"target_chars":10000}}
